"state","agency","jurisdiction","filing_type","website"
"VA","Virginia Department of Professional and Occupational Regulation (DPOR)","Real estate license violations, professional misconduct","License complaint","https://www.dpor.virginia.gov"
"NC","North Carolina Real Estate Commission","Real estate license violations","License complaint","https://www.ncrec.gov"
"TX","Texas Real Estate Commission","Real estate license violations","License complaint","https://www.trec.texas.gov"
"MD","Maryland Department of Labor","Professional licensing violations","License complaint","https://www.dllr.state.md.us"
"MO","Missouri Division of Professional Registration","Real estate license violations","License complaint","https://www.pr.mo.gov"
"NE","Nebraska Real Estate Commission","Real estate license violations","License complaint","https://www.rec.ne.gov"
